
77	Iluminação	138	Lâmpadas	3253	LUMINARIA DE SOBREPOR EM CHAPA DE ACO PARA 2 LAMPADAS FLUORESCENTES DE *18* W, ALETADA, COMPLETA (LAMPADAS E REATOR INCLUSOS)
77	Iluminação	138	Lâmpadas	3254	LUMINARIA DE SOBREPOR EM CHAPA DE ACO PARA 2 LAMPADAS FLUORESCENTES DE *18* W, PERFIL COMERCIAL (NAO INCLUI REATOR E LAMPADAS)
77	Iluminação	138	Lâmpadas	3255	LUMINARIA DE SOBREPOR EM CHAPA DE ACO PARA 2 LAMPADAS FLUORESCENTES DE *36* W, ALETADA, COMPLETA (LAMPADAS E REATOR INCLUSOS)
77	Iluminação	138	Lâmpadas	8055	LUMINARIA DE SOBREPOR EM CHAPA DE ACO PARA 2 LAMPADAS FLUORESCENTES DE 36 W, PERFIL COMERCIAL
77	Iluminação	138	Lâmpadas	3256	LUMINARIA DE SOBREPOR EM CHAPA DE ACO PARA 2 LAMPADAS FLUORESCENTES DE *36* W, PERFIL COMERCIAL (NAO INCLUI REATOR E LAMPADAS)
77	Iluminação	138	Lâmpadas	17887	Luminária de sobrepor p/ 2 lâmpadas LED 120 cm
77	Iluminação	138	Lâmpadas	3257	LUMINARIA DE TETO PLAFON/PLAFONIER EM PLASTICO COM BASE E27, POTENCIA MAXIMA 60 W (NAO INCLUI LAMPADA)
77	Iluminação	138	Lâmpadas	11018	LUMINARIA DECORATIVA,PARA ILUMINACAO PUBLICA E ESTACIONAMENTOS,COM TRES PETALAS,PARA LAMPADA LED DE 50W,EQUIPADA COM CELULA FOTOELETRICA,INCLUSIVE LAMPADA
77	Iluminação	138	Lâmpadas	20043	Luminária em alumínio estampado e anodizado, COM BRAÇO e LÂMPADA e REATOR
77	Iluminação	138	Lâmpadas	11020	LUMINARIA FECHADA ,PARA ILUMINACAO DE QUADRAS DE ESPORTES E AFINS,PARA LAMPADA LED DE 100W,
77	Iluminação	138	Lâmpadas	20056	Luminária fechada para lâmpada até 250W com braço curvo
77	Iluminação	138	Lâmpadas	3259	LUMINARIA HERMETICA IP-65 PARA 2 DUAS LAMPADAS DE 14/16/18/20 W (NAO INCLUI REATOR E LAMPADAS)
77	Iluminação	138	Lâmpadas	3260	LUMINARIA HERMETICA IP-65 PARA 2 DUAS LAMPADAS DE 28/32/36/40 W (NAO INCLUI REATOR E LAMPADAS)
77	Iluminação	138	Lâmpadas	15320	LUMINÁRIA PENDENTE, TIPO MÓDULO DE LED LINEAR, 52,5W (1 LÂMPADA)
77	Iluminação	138	Lâmpadas	15189	Luminaria petala corpo em aluminio injetado de alta pressao fornecido com reator eletromagnetico impregnado de alto fator de potencia com capacitor e ignitor acabamento com pintura eletroestatica na cor cinza globo de vidro boro-silicato e refletor de aluminio de alta pureza com encaixe para poste tubular de diametro 60, 3mm para 1 lampada tubular a vapor de sodio 150W, 220V 60HHz
77	Iluminação	138	Lâmpadas	3265	LUMINARIA PLAFON REDONDO COM VIDRO FOSCO DIAMETRO *25* CM, PARA 1 LAMPADA, BASE E27, POTENCIA MAXIMA 40/60 W (NAO INCLUI LAMPADA)
77	Iluminação	138	Lâmpadas	3266	LUMINARIA PLAFON REDONDO COM VIDRO FOSCO DIAMETRO *30* CM, PARA 2 LAMPADAS, BASE E27, POTENCIA MAXIMA 40/60 W (NAO INCLUI LAMPADAS)
77	Iluminação	138	Lâmpadas	17236	Luminária plafonier branca fosca 1 lâmpada
77	Iluminação	138	Lâmpadas	23597	Luminária Policarbonato IP65 p/ 2 Lâmpadas 32W - OUROLUX 01527
77	Iluminação	138	Lâmpadas	22608	Luminária quadrada embutida, corpo em alumínio com acabamento em pintura eletrostática epóxi branca, difusor em acrílico translúcido, driver incorporado 127-230V, temperatura de cor 4000K. Para lâmpada 12W. Fluxo luminoso: 840 LM. Medida aproximada em mm:
77	Iluminação	138	Lâmpadas	22607	Luminária quadrada embutida, corpo em alumínio com acabamento em pintura eletrostática epóxi branca, difusor em acrílico translúcido, driver incorporado 127-230V, temperatura de cor 4000K. Para lâmpada 18W. Fluxo luminoso 1260 LM. Medida aproximada em mm:
77	Iluminação	138	Lâmpadas	22609	Luminária quadrada embutida, corpo em alumínio com acabamento em pintura eletrostática epóxi branca, difusor em acrílico translúcido, driver incorporado 127-230V, temperatura de cor 4000K. Para lâmpada 24W. Fluxo luminoso 1680 LM. Medida aproximada em mm:
77	Iluminação	138	Lâmpadas	3269	LUMINARIA SPOT DE SOBREPOR EM ALUMINIO COM ALETA PLASTICA PARA 1 LAMPADA, BASE E27, POTENCIA MAXIMA 40/60 W (NAO INCLUI LAMPADA)
77	Iluminação	138	Lâmpadas	3270	LUMINARIA SPOT DE SOBREPOR EM ALUMINIO COM ALETA PLASTICA PARA 2 LAMPADAS, BASE E27, POTENCIA MAXIMA 40/60 W (NAO INCLUI LAMPADA)
77	Iluminação	138	Lâmpadas	23227	LUMINÁRIA - SPOT PARA ELETROCALHA - PRETA - 1 LÂMPADA - 127/220V
77	Iluminação	138	Lâmpadas	10600	Luminária tipo arandela, para uma lâmpada tubular vapor metálico de 70W, fornecido com reator, ignitor e lâmpada.
77	Iluminação	138	Lâmpadas	8683	LUMINÁRIA TIPO CALHA DE EMBUTIR PARA LÂMPADA TUBULAR T-8
77	Iluminação	138	Lâmpadas	3271	LUMINARIA TIPO TARTARUGA A PROVA DE TEMPO, GASES, VAPOR E PO, EM ALUMINIO, COM GRADE, BASE E27, POTENCIA MAXIMA 100 W - REF Y 25/1 (NAO INCLUI LAMPADA)
77	Iluminação	138	Lâmpadas	3272	LUMINARIA TIPO TARTARUGA PARA AREA EXTERNA EM ALUMINIO, COM GRADE, PARA 1 LAMPADA, BASE E27, POTENCIA MAXIMA 40/60 W (NAO INCLUI LAMPADA)
77	Iluminação	138	Lâmpadas	10599	Luminária via publica tipo petála, para uma lâmpada tubular vapor metálico de 250W, fornecido com reator, ignitor e lâmpada.
77	Iluminação	138	Lâmpadas	3644	MINUTERIA ELETRONICA COLETIVA COM POTENCIA MAXIMA RESISTIVA PARA LAMPADAS FLUORESCENTES DE *300* W ( 110 V ) / *600* W ( 110 V )
77	Iluminação	138	Lâmpadas	22382	Plug superior do soquete da lâmpada
77	Iluminação	138	Lâmpadas	15227	Projetor para uso externo, para lâmpada tubular a vapor de sódio de 250W, 220V, 60Hz, corpo em alumínio fundido e refletor em alumínio anodizado, soquete de porcelana E-40, vidro temperado, suporte de fixação em aço galvanizado, fornecido com reator eletromagnético impregnado de alto fator de potência, com capacitor e ignitor, entrada da fiação protegida com prensa-cabo. Philips ou equivalente. Ref.: RVP251 + VSE250A26IGSE, Philips ou equivalente. Uni: cj.
77	Iluminação	138	Lâmpadas	15188	Projetor para uso externo para lampada tubular a vapor de sodio de 250W, 220V 60Hz, corpo em aluminio fundido e refletor em aluminio anodizado soquete de porcelana E40 vidro temperado suporte de fixação em aço galvanizado, fornecido com reator eletromagnetico impregnado de alto fator de potencia com capacitor e ignitor entrada da fiação protegida com prensa-cabo
77	Iluminação	138	Lâmpadas	15226	Projetor para uso externo, para lâmpada tubular a vapor de sódio de 400W, 220V, 60Hz, corpo em alumínio fundido e refletor em alumínio anodizado, soquete de porcelana E-40, vidro temperado, suporte de fixação em aço galvanizado, fornecido com reator eletromagnético impregnado de alto fator de potência, com capacitor e ignitor, entrada da fiação protegida com prensa-cabo. Philips ou equivalente. Ref.: RVP351 + VSE400A26IGSE, Philips ou equivalente. Uni: cj.
77	Iluminação	138	Lâmpadas	15187	Projetor para uso externo para lampada tubular a vapor de sodio de 400W, 220V 60Hz, corpo em aluminio fundido e refletor em aluminio anodizado soquete de porcelana E40 vidro temperado suporte de fixação em aço galvanizado, fornecido com reator eletromagnetico impregnado de alto fator de potencia com capacitor e ignitor entrada da fiação protegida com prensa-cabo
77	Iluminação	138	Lâmpadas	4231	PROJETOR RETANGULAR FECHADO PARA LAMPADA VAPOR DE MERCURIO/SODIO 250 W A 500 W, CABECEIRAS EM ALUMINIO FUNDIDO, CORPO EM ALUMINIO ANODIZADO, PARA LAMPADA E40 FECHAMENTO EM VIDRO TEMPERADO.
77	Iluminação	138	Lâmpadas	10598	Projetor retangular, para uma lâmpada tubular vapor metálico de 400W, fornecido com reator, ignitor e lâmpada.
77	Iluminação	138	Lâmpadas	15543	REATOR DE USO INTERNO/INTEGRADO PARA LÂMPADA A VAPOR DE SÓDIO AP 70W, 220V, 60HZ, FATOR DE POTÊNCIA SUPERIOR A 0,92, CERTIFICAÇÃO ENCE. GARANTIA DE 03 ANOS.
77	Iluminação	138	Lâmpadas	4299	REATOR ELETRONICO BIVOLT PARA 1 LAMPADA FLUORESCENTE DE 18/20 W
77	Iluminação	138	Lâmpadas	4300	REATOR ELETRONICO BIVOLT PARA 1 LAMPADA FLUORESCENTE DE 36/40 W
77	Iluminação	138	Lâmpadas	4301	REATOR ELETRONICO BIVOLT PARA 2 LAMPADAS FLUORESCENTES DE 14 W
77	Iluminação	138	Lâmpadas	4302	REATOR ELETRONICO BIVOLT PARA 2 LAMPADAS FLUORESCENTES DE 18/20 W
77	Iluminação	138	Lâmpadas	4303	REATOR ELETRONICO BIVOLT PARA 2 LAMPADAS FLUORESCENTES DE 36/40 W
77	Iluminação	138	Lâmpadas	22839	Reator Externo Vapor Metálico 1000w 220V, para lâmpada vapor metálico 1000w.
77	Iluminação	138	Lâmpadas	4304	REATOR INTERNO/INTEGRADO PARA LAMPADA VAPOR METALICO 400 W, ALTO FATOR DE POTENCIA
77	Iluminação	138	Lâmpadas	22252	Reator interno para lâmpada vapor de sódio alta pressão
77	Iluminação	138	Lâmpadas	22163	Reator interno para lâmpada vapor de sódio alta pressão 70w
77	Iluminação	138	Lâmpadas	4306	REATOR P/ 1 LAMPADA VAPOR DE MERCURIO 125W USO EXT
77	Iluminação	138	Lâmpadas	4307	REATOR P/ 1 LAMPADA VAPOR DE MERCURIO 250W USO EXT
77	Iluminação	138	Lâmpadas	4308	REATOR P/ 1 LAMPADA VAPOR DE MERCURIO 400W USO EXT
77	Iluminação	138	Lâmpadas	15938	REATOR P/ LAMPADA VAPOR DE SODIO 250 W USO EXT INTALAÇÕES ELETRICAS, TELEFONICAS, LOGICA, TV E AUDIO (AMPLA PARTICIPAÇÃO)
77	Iluminação	138	Lâmpadas	4305	REATOR P/ LAMPADA VAPOR DE SODIO 250W USO EXT
77	Iluminação	138	Lâmpadas	16922	Refletor para lâmpada de vapor metálico de 1.000W
77	Iluminação	138	Lâmpadas	15715	Refletor para lâmpada de vapor metalico de 1000W
77	Iluminação	138	Lâmpadas	4327	REFLETOR REDONDO EM ALUMINIO ANODIZADO PARA LAMPADA VAPOR DE MERCURIO/SODIO, CORPO EM ALUMINIO COM PINTURA EPOXI, PARA LAMPADA E-27 DE 300 W, COM SUPORTE REDONDO E ALCA REGULAVEL PARA FIXACAO.
77	Iluminação	138	Lâmpadas	4467	SENSOR DE PRESENCA BIVOLT COM FOTOCELULA PARA QUALQUER TIPO DE LAMPADA, POTENCIA MAXIMA *1000* W, USO EXTERNO
77	Iluminação	138	Lâmpadas	4468	SENSOR DE PRESENCA BIVOLT DE PAREDE COM FOTOCELULA PARA QUALQUER TIPO DE LAMPADA POTENCIA MAXIMA *1000* W, USO INTERNO
77	Iluminação	138	Lâmpadas	4469	SENSOR DE PRESENCA BIVOLT DE PAREDE SEM FOTOCELULA PARA QUALQUER TIPO DE LAMPADA POTENCIA MAXIMA *1000* W, USO INTERNO
77	Iluminação	138	Lâmpadas	4470	SENSOR DE PRESENCA BIVOLT DE TETO COM FOTOCELULA PARA QUALQUER TIPO DE LAMPADA POTENCIA MAXIMA *1000* W, USO INTERNO
77	Iluminação	138	Lâmpadas	4471	SENSOR DE PRESENCA BIVOLT DE TETO SEM FOTOCELULA PARA QUALQUER TIPO DE LAMPADA POTENCIA MAXIMA *900* W, USO INTERNO
77	Iluminação	138	Lâmpadas	17322	Soquete antivibratório para lâmpada tubular T8/T12
77	Iluminação	138	Lâmpadas	22376	Soquete bi pino com fixação para lâmpada halógena 30/45W – 6.6A
77	Iluminação	138	Lâmpadas	4510	SOQUETE DE BAQUELITE BASE E27, PARA LAMPADAS
77	Iluminação	138	Lâmpadas	16911	SOQUETE DE LÂMPADA FLUORESCENTE COM RABICHO CEBOLINHA
77	Iluminação	138	Lâmpadas	4511	SOQUETE DE PORCELANA BASE E27, FIXO DE TETO, PARA LAMPADAS
77	Iluminação	138	Lâmpadas	4512	SOQUETE DE PORCELANA BASE E27, PARA USO AO TEMPO, PARA LAMPADAS
77	Iluminação	138	Lâmpadas	4513	SOQUETE DE PVC / TERMOPLASTICO BASE E27, COM CHAVE, PARA LAMPADAS
77	Iluminação	138	Lâmpadas	4514	SOQUETE DE PVC / TERMOPLASTICO BASE E27, COM RABICHO, PARA LAMPADAS
77	Iluminação	138	Lâmpadas	16856	SUPORTE LAMPADA PORCELANA E -27 p/ LUMINÁRIA DE RUA
77	Iluminação	138	Lâmpadas	22101	Suporte plafon simples redondo, em PVC na cor branco, para uma lâmpada soquete E-27.
77	Iluminação	139	Luminárias	1037	BRACO P/ LUMINARIA PUBLICA 1 X 1,50M ROMAGNOLE OU EQUIV
77	Iluminação	139	Luminárias	14873	Branca de embutir
77	Iluminação	139	Luminárias	15598	Chave específica para luminária Maccomevap
77	Iluminação	139	Luminárias	20386	CONECTOR PARA MANGUEIRA LED REDONDA 220V
77	Iluminação	139	Luminárias	7062	[cópia] LUMINARIA DE LED PARA ILUMINACAO PUBLICA, DE 98 W  ATE 137 W, INVOLUCRO EM ALUMINIO OU ACO INOX (COLETADO CAIXA)
77	Iluminação	139	Luminárias	15592	Difusor em policarbonato para luminária Maccomevap
77	Iluminação	139	Luminárias	365	Fotocélula acionamento luminárias externas
77	Iluminação	139	Luminárias	16424	Kit 3 Suportes Para Refletor Int/ext. 60cm Curvo Preto
77	Iluminação	139	Luminárias	19167	Kit Globo bolinha PVC + Plafonier PVC p/ luminária
77	Iluminação	139	Luminárias	15597	LED específico para luminária Maccomevap
77	Iluminação	139	Luminárias	16608	Luminária 120w
77	Iluminação	139	Luminárias	3235	LUMINARIA ABERTA P/ ILUMINACAO PUBLICA, TIPO X-57 PETERCO OU EQUIV
77	Iluminação	139	Luminárias	5846	Luminária Arandela LED sobrepor em alumínio
77	Iluminação	139	Luminárias	5682	LUMINÁRIA CHAPA LED EMBUTIR 22 X 22CM
77	Iluminação	139	Luminárias	5680	luminária chapa led embutir 60x60cm
77	Iluminação	139	Luminárias	5683	luminária chapa led sobrepor 22x22cm
77	Iluminação	139	Luminárias	5681	luminária chapa led sobrepor 60x60cm
77	Iluminação	139	Luminárias	15322	LUMINÁRIA CIRCULAR DE EMBUTIR, LINHA MINI-NETUNO, 7W, 4000K E IRC80, 85MM DE DIÂMETRO.
77	Iluminação	139	Luminárias	8597	Luminária De Embutir LED Em Chapa De Aço, Cor: Branco Com Refletor E Aletas Parabólicas Em Alumínio Anodizado Brilhante De Alta Refletância - (Dimensão:26,7x61,7x4)
77	Iluminação	139	Luminárias	8596	Luminária De Embutir LED Em Chapa De Aço, Cor: Branco Com Refletor E Aletas Parabólicas Em Alumínio Anodizado Brilhante De Alta Refletância - (Dimensão: 29,1x1.243x4)
77	Iluminação	139	Luminárias	8599	Luminária De Embutir LED Em Plástico Injetado E Difusor Translúcido Cor: Branco - (Dimensão:61,8x61,8x4)
77	Iluminação	139	Luminárias	15926	Luminaria de Embutir Quadrada
77	Iluminação	139	Luminárias	3239	LUMINARIA DE EMERGENCIA 30 LEDS, POTENCIA 2 W, BATERIA DE LITIO, AUTONOMIA DE 6 HORAS
77	Iluminação	139	Luminárias	22082	Luminária de emergência branca, com 30 LEDS, bivolt, potência mínima de 2W, recarregável.
77	Iluminação	139	Luminárias	10843	Luminária de emergência c/ 30 leds bivolt 175x49x25mm
77	Iluminação	139	Luminárias	22250	Luminária de emergência LED
77	Iluminação	139	Luminárias	22161	Luminária de emergência LED 2 faróis bivolt branco
77	Iluminação	139	Luminárias	17117	Luminária de LED 100W
77	Iluminação	139	Luminárias	17118	Luminária de LED 150W
77	Iluminação	139	Luminárias	23102	Luminária de Led 50 W (Refletor)
77	Iluminação	139	Luminárias	8131	LUMINÁRIA DE LED - PARA ILUMINAÇÃO PÚBLICA
77	Iluminação	139	Luminárias	3240	LUMINARIA DE LED PARA ILUMINACAO PUBLICA, DE 138 W ATE 180 W, INVOLUCRO EM ALUMINIO OU ACO INOX
77	Iluminação	139	Luminárias	11477	LUMINARIA DE LED PARA ILUMINAÇÃO PUBLICA, DE 138W ATE 180W, INVOLUCRO EM ALUMINIO OU AÇO INOX.
77	Iluminação	139	Luminárias	3241	LUMINARIA DE LED PARA ILUMINACAO PUBLICA, DE 181 W ATE 239 W, INVOLUCRO EM ALUMINIO OU ACO INOX
77	Iluminação	139	Luminárias	3242	LUMINARIA DE LED PARA ILUMINACAO PUBLICA, DE 240 W ATE 350 W, INVOLUCRO EM ALUMINIO OU ACO INOX
77	Iluminação	139	Luminárias	3243	LUMINARIA DE LED PARA ILUMINACAO PUBLICA, DE 33 W ATE 50 W, INVOLUCRO EM ALUMINIO OU ACO INOX
77	Iluminação	139	Luminárias	3244	LUMINARIA DE LED PARA ILUMINACAO PUBLICA, DE 51 W ATE 67 W, INVOLUCRO EM ALUMINIO OU ACO INOX
77	Iluminação	139	Luminárias	3245	LUMINARIA DE LED PARA ILUMINACAO PUBLICA, DE 68 W ATE 97 W, INVOLUCRO EM ALUMINIO OU ACO INOX
77	Iluminação	139	Luminárias	3246	LUMINARIA DE LED PARA ILUMINACAO PUBLICA, DE 98 W ATE 137 W, INVOLUCRO EM ALUMINIO OU ACO INOX
77	Iluminação	139	Luminárias	6588	LUMINARIA DE LED PARA ILUMINACAO PUBLICA, DE 98 W  ATE 137 W, INVOLUCRO EM ALUMINIO OU ACO INOX (COLETADO CAIXA)
77	Iluminação	139	Luminárias	11478	LUMINARIA DE LED PARA ILUMINAÇÃO PUBLICA, DE 98W ATE 137W, INVOLUCRO EM ALUMINIO OU AÇO INOX.
77	Iluminação	139	Luminárias	22009	Luminária de LED para iluminação pública. Fluxo luminoso mínimo de 16.000 lumens. Potência de até 100 W.
77	Iluminação	139	Luminárias	22011	Luminária de LED para iluminação pública. Fluxo luminoso mínimo de 24.000 lumens. Potência de até 150 W.
77	Iluminação	139	Luminárias	22007	Luminária de LED para iluminação pública. Fluxo luminoso mínimo de 9.600 lumens. Potência de até 60 W.
77	Iluminação	139	Luminárias	16755	Luminaria de led para iluminação publica, potencia 68w a 97w, temperatura de cor 5000k involucro em aluminio ou aço inox
77	Iluminação	139	Luminárias	16756	Luminária de led para iluminação publica, potencia 98w a 137w, temperatura de cor 5000k involucro em aluminio ou aço inox
77	Iluminação	139	Luminárias	8598	Luminária De Sobrepor LED Em Chapa De Aço, Cor: Branco Com Refletor E Aletas Parabólicas Em Alumínio Anodizado Brilhante De Alta Refletância - (Dimensão: 26,7x61,7x4)
77	Iluminação	139	Luminárias	19448	Luminária decorativa LED 60W
77	Iluminação	139	Luminárias	10678	Luminária Decorativa TIPO EGEU II Led 150w C/poste cônico Cont. Aço reto de 5mts C/base para fixação
77	Iluminação	139	Luminárias	10677	Luminária Decorativa TIPO EGEU II Led 150w C/poste cônico Cont. Aço reto de 7mts C/base para fixação
77	Iluminação	139	Luminárias	3258	LUMINARIA DUPLA P/SINALIZACAO, TIPO WETZEL AS-2/110 OU EQUIV
77	Iluminação	139	Luminárias	9650	Luminária Emergência 30 LEDs
77	Iluminação	139	Luminárias	6220	LUMINARIA FECHADA P/ ILUMINACAO PUBLICA, TIPO ABL 50/F OU EQUIV, P/ LAMPADA A VAPOR DE MERCURIO 400W
77	Iluminação	139	Luminárias	22267	Luminária LED
77	Iluminação	139	Luminárias	18954	Luminária LED 100W
77	Iluminação	139	Luminárias	18953	Luminária LED 150W
77	Iluminação	139	Luminárias	5904	LUMINÁRIA LED 2 x 28 W  Á PROVA DE EXPLOSÃO
77	Iluminação	139	Luminárias	5863	LUMINÁRIA LED 200 LÚMENS
77	Iluminação	139	Luminárias	16377	Luminária LED 40 W Sigma S Tecnowatt
77	Iluminação	139	Luminárias	22184	Luminária LED 40w
77	Iluminação	139	Luminárias	18952	Luminária LED 50W
77	Iluminação	139	Luminárias	22180	Luminária LED 60w
77	Iluminação	139	Luminárias	22181	Luminária LED 80w
77	Iluminação	139	Luminárias	6673	Luminária LED com sensor de movimento
77	Iluminação	139	Luminárias	8600	Luminária LED De Embutir No Solo - Corpo De Alumínio Injetado E Aro Anteofuscamento
77	Iluminação	139	Luminárias	6344	Luminária LED industrial 40W 5400LM
77	Iluminação	139	Luminárias	20109	Luminária Led para Poste 150w
77	Iluminação	139	Luminárias	3261	LUMINARIA LED PLAFON REDONDO DE SOBREPOR BIVOLT 12/13 W,  D = *17* CM
77	Iluminação	139	Luminárias	19443	Luminária LED pública 100W
77	Iluminação	139	Luminárias	19444	Luminária LED pública 150W
77	Iluminação	139	Luminárias	19445	Luminária LED pública 200W
77	Iluminação	139	Luminárias	19441	Luminária LED pública 30W
77	Iluminação	139	Luminárias	19442	Luminária LED pública 50W
77	Iluminação	139	Luminárias	3262	LUMINARIA LED REFLETOR RETANGULAR BIVOLT, LUZ BRANCA, 10 W
77	Iluminação	139	Luminárias	3263	LUMINARIA LED REFLETOR RETANGULAR BIVOLT, LUZ BRANCA, 30 W
77	Iluminação	139	Luminárias	3264	LUMINARIA LED REFLETOR RETANGULAR BIVOLT, LUZ BRANCA, 50 W
77	Iluminação	139	Luminárias	18766	LUMINÁRIA LED RETANGULAR DE SOBREPOR OU PENDENTE COM DIFUSOR TRANSLÚCIDO OU TRANSPARENTE, 4000 K, FLUXO LUMINOSO DE 4252 A 4350 LM, POTÊNCIA DE 33 A 37 W
77	Iluminação	139	Luminárias	5864	LUMINÁRIA LED SLIM 100 LÚMENS
77	Iluminação	139	Luminárias	21383	LUMINÁRIA - LED SOBREPOR BRANCA BIVOLT LED PLACA DE LED 75,00MM 1.200,00MM
77	Iluminação	139	Luminárias	18737	LUMINÁRIA - LED SOBREPOR BRANCA BIVOLT PLACA DE LED 75,00MM X 1.200,00MM
77	Iluminação	139	Luminárias	17130	Luminária LED sobrepor branca bivolt - placa de LED 75x1200mm
77	Iluminação	139	Luminárias	20811	Luminária painel de led slim quadrada de sobrepor bivolt 18w branca 6.500k mínimo de 1260 Lumens
77	Iluminação	139	Luminárias	20812	Luminária painel de led slim quadrada de sobrepor bivolt 36w branca 6.500k mínimo 1680 Lumens.
77	Iluminação	139	Luminárias	20645	Luminária painel de LED slim quadrada sobrepor bivolt 18 W 6500 K
77	Iluminação	139	Luminárias	20646	Luminária painel de LED slim quadrada sobrepor bivolt 36 W 6500 K
77	Iluminação	139	Luminárias	20728	Luminária painel LED slim quadrada sobrepor bivolt 18W 6500K ≥1260 lm
77	Iluminação	139	Luminárias	20729	Luminária painel LED slim quadrada sobrepor bivolt 36W 6500K ≥1680 lm
77	Iluminação	139	Luminárias	7113	LUMINÁRIA PARA ILUMINAÇÃO DECORATIVA COM CORPO DE ALUMÍNIO E DIFUSOR EM POLICARBONATO TRANSPARENTE
77	Iluminação	139	Luminárias	15057	Luminária Parede Curva Globo - 20cm altura - 18cm largura
77	Iluminação	139	Luminárias	8684	LUMINÁRIA PLAFON DE EMBUTIR LED 24W
77	Iluminação	139	Luminárias	6405	Luminária plafon LED de embutir 120x10cm (a 120x15cm)
77	Iluminação	139	Luminárias	6404	Luminária plafon LED de embutir 60x10cm (até 65x15cm)
77	Iluminação	139	Luminárias	6674	Luminária plafon LED de sobrepor 120x10cm (a 120x15cm)
77	Iluminação	139	Luminárias	22083	Luminária plafon, painel LED 30x30cm, de embutir, bivolt, 4.000k, potência mínima de 24W.
77	Iluminação	139	Luminárias	22084	Luminária plafon, painel LED 30x30cm, de sobrepor, bivolt, 4.000k, potência mínima de 24W.
77	Iluminação	139	Luminárias	3267	LUMINARIA PROVA DE TEMPO PETERCO Y.31/1
77	Iluminação	139	Luminárias	15717	Luminária Pública a LED de 300W
77	Iluminação	139	Luminárias	19078	Luminária Pública de LED 100W
77	Iluminação	139	Luminárias	19215	Luminária pública de LED 150W
77	Iluminação	139	Luminárias	19211	Luminária pública de LED 30W
77	Iluminação	139	Luminárias	22364	Luminária pública de LED 40W
77	Iluminação	139	Luminárias	19212	Luminária pública de LED 50W
77	Iluminação	139	Luminárias	22360	Luminária pública de LED 60W
77	Iluminação	139	Luminárias	19213	Luminária pública de LED 80W
77	Iluminação	139	Luminárias	20058	Luminária publica de LED com Potência máxima de 100W
77	Iluminação	139	Luminárias	20057	Luminária publica de LED com Potência máxima de 200W
77	Iluminação	139	Luminárias	20059	Luminária publica de LED com Potência máxima de 60W
77	Iluminação	139	Luminárias	20042	Luminária pública de led solar 200W.
77	Iluminação	139	Luminárias	20648	Luminária pública LED 100 W
77	Iluminação	139	Luminárias	20731	Luminária pública LED 100W, ≥12000 lm, eficiência ≥120 lm/W, IP66, IK08, L70 ≥50.000h
77	Iluminação	139	Luminárias	20649	Luminária pública LED 150 W
77	Iluminação	139	Luminárias	20732	Luminária pública LED 150W, ≥18000 lm, eficiência ≥120 lm/W, IP66, IK08, L70 ≥50.000h
77	Iluminação	139	Luminárias	20647	Luminária pública LED 50 W
77	Iluminação	139	Luminárias	20730	Luminária pública LED 50W, ≥6000 lm, eficiência ≥120 lm/W, IP66, IK08, L70 ≥50.000h
77	Iluminação	139	Luminárias	20814	Luminária pública LED, com potência mínima de 100 W, fluxo luminoso mínimo de 12.000 lm e eficiência luminosa mínima de 120 lm/W.
77	Iluminação	139	Luminárias	20815	Luminária pública LED, com potência mínima de 150 W, fluxo luminoso mínimo de 18.000 lm e eficiência luminosa mínima de 120 lm/W.
77	Iluminação	139	Luminárias	20813	Luminária pública LED, com potência mínima de 50 W, fluxo luminoso mínimo de 6.000 lm e eficiência luminosa mínima de 120 lm/W.
77	Iluminação	139	Luminárias	15111	LUMINARIA PUBLICA LED RY COM RELE FOTOELETRICO EMBUTIDO PARA POSTE COM 250W, BIVOLT IP68 COM ENCAIXE PARA 48MM
77	Iluminação	139	Luminárias	21857	Luminária pública para poste de rua modelo Pétala Led 100W Branco Frio 6500k. Diâmetro Interno do encaixe: 6,5 cm
77	Iluminação	139	Luminárias	21858	Luminária pública para poste de rua modelo Pétala Led 200W Branco Frio 6500k. Diâmetro Interno do encaixe: 6,5 cm
77	Iluminação	139	Luminárias	21344	LUMINÁRIA SOBREPOR 2X110WX240MM T8 BR
77	Iluminação	139	Luminárias	15324	LUMINÁRIA SOBREPOR OU PENDENTE HERMÉTICA COM ALÇA PARA PENDURAR EM ESTRUTURA METÁLICA
77	Iluminação	139	Luminárias	3268	LUMINARIA SOLAR LED EXTERNA, TIPO ARANDELA DE PAREDE, EM ALUMINIO, 16 LEDS, LUZ BRANCA, *180* LUMENS, CAPACIDADE DE ILUMINACAO ATE 36 H, RETANGULAR, *13 X 9 X 7* (C X L X A), COM SENSOR DE MOVIMENTO / PRESENCA, BATERIA RECARREGAVEL COM LUZ SOLAR, RESISTENTE AO CALOR, A PROVA DE AGUA E POEIRA/ IMPERMEAVEL, IP65
77	Iluminação	139	Luminárias	12120	LUMINARIA SPOT DE PISO LED 6W 220V, USO EXTERNO
77	Iluminação	139	Luminárias	16412	LUMINÁRIA SPOT LED EMBUTIDA 3W BIVOLT 3000K, DIAMETRO FLANGE 37MM, DIAMETRO NICHO 31,5MM, ALTURA 29MM
77	Iluminação	139	Luminárias	18991	LUMINÁRIA TIPO ARANDELA (TARTARUGA) DE USO EXTERNO, BLINDADA COM GRADE ( MÉDIA ) - BASE E-27
77	Iluminação	139	Luminárias	6924	Luminária_led
77	Iluminação	139	Luminárias	16425	Luminárias arandelas tipo tartaruga
77	Iluminação	139	Luminárias	12452	LUMINÁRIAS BI DIRECIONAL 2X105W 6,6A SN:00,07 63589 INL02– RE – IC + 2X105W + W/W+SC
77	Iluminação	139	Luminárias	12165	LUMINARIAS SOLAR LED EXTERNA, TIPO ARANDELA DE PAREDE, EM ALUMINIO, 16 LEDS, LUZ BRANCA, *180* LUMENS, CAPACIDADE DE ILUMINACAO ATE 36 H, RETANGULAR, *13 X 9 X 7* (C X L X A), COM SENSOR DE MOVIMENTO / PRESENCA, BATERIA RECARREGAVEL COM LUZ SOLAR, RESISTENTE AO CALOR, A PROVA DE AGUA E POEIRA/ IMPERMEAVEL.
77	Iluminação	139	Luminárias	15541	Luz de emergência 30 leds
77	Iluminação	139	Luminárias	15596	Módulo LED para luminária Maccomevap
77	Iluminação	139	Luminárias	17432	Painel LED 18W de embutir
77	Iluminação	139	Luminárias	17431	Painel LED 24W de sobrepor
77	Iluminação	139	Luminárias	17445	Painel LED 30W de sobrepor
77	Iluminação	139	Luminárias	17433	Painel LED 36W de sobrepor
77	Iluminação	139	Luminárias	15319	PAINEL LED DE EMBUTIR, LINHA ECO, 24W, 4000K, 270W270MM
77	Iluminação	139	Luminárias	3923	PEDRA QUARTZITO OU CALCARIO LAMINADO, CACO, TIPO CARIRI, ITACOLOMI, LAGOA SANTA, LUMINARIA, PIRENOPOLIS, SAO TOME OU OUTRAS SIMILARES DA REGIAO, E=  *1,5 A *2,5 CM
77	Iluminação	139	Luminárias	3924	PEDRA QUARTZITO OU CALCARIO LAMINADO, SERRADA, TIPO CARIRI, ITACOLOMI, LAGOA SANTA, LUMINARIA, PIRENOPOLIS, SAO TOME OU OUTRAS SIMILARES DA REGIAO, *20 X *40 CM, E=  *1,5 A *2,5 CM
